{
  "approval_ref": {
    "hash": "1a589d7e859e6c80645e8ab259618e7d30dc1325dd9bd60adb8384b841b30c24",
    "id": "AUT-APR-20260719032543646-fba399",
    "path": ".sdlc/autonomy/approvals/AUT-APR-20260719032543646-fba399.json"
  },
  "authority_assurance": {
    "mode": "audit_only",
    "receipt_ref": null,
    "source": "declared_cli_attribution",
    "verified": false
  },
  "autonomy_ceiling": "bounded-autonomous",
  "checkpoints": [
    "deploy.remote",
    "pull_request.merge"
  ],
  "constraints": {
    "allowed_capabilities": [
      "filesystem.read",
      "git.commit",
      "git.push",
      "pull_request.create",
      "pull_request.merge",
      "pull_request.update",
      "repository.write"
    ],
    "allowed_environments": [
      "ci",
      "local"
    ],
    "allowed_tools": [
      "gh",
      "git",
      "node",
      "npm",
      "python3"
    ],
    "allowed_write_paths": [
      ".codex-plugin",
      ".github",
      ".sdlc",
      "README.md",
      "config",
      "docs",
      "lib",
      "package.json",
      "schemas",
      "scripts",
      "test"
    ],
    "budget_ref": null,
    "forbidden_actions": [
      "budget-extension",
      "destructive-action",
      "environment-change",
      "external-access",
      "external-publication",
      "gate-bypass",
      "global-install",
      "irreversible-migration",
      "new-tool-or-capability",
      "new-write-path",
      "production-access",
      "protected-branch-merge",
      "remote-deploy",
      "requirement-change",
      "scope-expansion",
      "secret-access",
      "security-privacy-compliance-decision"
    ]
  },
  "created_at": "2026-07-19T03:25:39.004Z",
  "exception_actions": [
    "budget-extension",
    "destructive-action",
    "environment-change",
    "external-access",
    "external-publication",
    "gate-bypass",
    "global-install",
    "irreversible-migration",
    "new-tool-or-capability",
    "new-write-path",
    "production-access",
    "protected-branch-merge",
    "remote-deploy",
    "requirement-change",
    "scope-expansion",
    "secret-access",
    "security-privacy-compliance-decision"
  ],
  "expires_at": null,
  "extensions": {
    "approved_profile_hash": "3b17a1ea58b43ae1d6690c40b9bcd1b5ecc8cdd97f9fa0c725644c36e8de8121"
  },
  "hash_algorithm": "sha256:stable-json:v1",
  "id": "AUT-REQ-ENT-RELEASE-R1-R1",
  "kind": "requirement_execution_profile",
  "material_scope": {
    "acceptance_criteria": [
      "The release artifact verifier rejects missing, unexpected, unsafe, symlinked or policy-divergent package entries and validates the real npm tarball.",
      "Installer V2 supports check, plan, apply, validate, confirm and restore with a durable transaction receipt, zero writes during planning and byte-preserved rollback.",
      "Installer V2 stages the personal marketplace and plugin without modifying global Codex configuration, AGENTS.md or RTK.md.",
      "The GitHub release workflow publishes only after the exact tarball and Installer V2 plan are verified, derives prerelease status from strict SemVer and remains retry-safe.",
      "Package metadata and user-facing documentation consistently identify v0.12.0 and make Installer V2 the canonical self-service path.",
      "Node.js 18, 20 and 24 release tests, the complete Node.js 24 suite, Python installer tests, static checks, dry-run packaging and real-package smoke validation pass before merge."
    ],
    "budget": null,
    "capabilities": [
      "filesystem.read",
      "gh",
      "git",
      "git.commit",
      "git.push",
      "node",
      "npm",
      "pull_request.create",
      "pull_request.merge",
      "pull_request.update",
      "python3",
      "repository.write"
    ],
    "environment": [
      "ci",
      "local"
    ],
    "integrations": [
      "npm pack and npm CLI package verification",
      "GitHub Actions release workflow and GitHub CLI",
      "Codex personal marketplace and plugin installer"
    ],
    "nfrs": [
      "Release verification must work on Node.js 18, 20 and 24 and installer tests must use the supported local Python runtime.",
      "No shell evaluation, credential material or host-specific absolute path may enter the packaged artifact."
    ],
    "non_goals": [
      "Do not publish to npm, create a GitHub release or push a tag in this pull request.",
      "Do not perform the local installation in this pull request; that requires a separate local-release choice.",
      "Do not access production or secrets and do not modify global Codex configuration, AGENTS.md or RTK.md."
    ],
    "objective": "Ship v0.12.0 with policy-driven package verification, a reversible Installer V2, and a verified retry-safe GitHub release workflow, while keeping publication and local installation separate.",
    "release_target": null,
    "requirement_constraints": [
      "Package verification and workflow guards must be deterministic, policy-driven and fail closed.",
      "Installer planning must be zero-write and restore must recover the exact pre-transaction state.",
      "Preserve the portfolio provider-subject compatibility check while extending package.json release checks."
    ],
    "scope": "Ship v0.12.0 with policy-driven package verification, a reversible Installer V2, and a verified retry-safe GitHub release workflow, while keeping publication and local installation separate.",
    "write_paths": [
      ".codex-plugin",
      ".github",
      ".sdlc",
      "README.md",
      "config",
      "docs",
      "lib",
      "package.json",
      "schemas",
      "scripts",
      "test"
    ]
  },
  "material_scope_hash": "1cbd0269b61d323cd22661b3c6552b7f500e5ddaa326ce1fbda2e197a8beea74",
  "phase_levels": {},
  "profile_hash": "226f84237ad9f096f813fcd3b79cc7daca4c7427d98a99bb0c38ec49d7a12a47",
  "requirement_ref": {
    "hash": "03860cac7acf44c53ee95dbdcfad644a5dca63c534ec48c7fe7c7e104acd482e",
    "id": "REQ-ENT-RELEASE-R1",
    "path": ".sdlc/requirements/REQ-ENT-RELEASE-R1.json",
    "version": 1
  },
  "schema_version": "requirement-execution-profile:v1",
  "status": "active",
  "updated_at": "2026-07-19T03:25:43.647Z",
  "valid_from": "2026-07-19T03:25:39.004Z",
  "version": 1
}
