{
  "approval_ref": {
    "hash": "8ec13093b8cd26d203ecb464e4205ba1b42fc2490041b18137433bfa63fb75f2",
    "id": "AUT-APR-20260719005548018-e8eb83",
    "path": ".sdlc/autonomy/approvals/AUT-APR-20260719005548018-e8eb83.json"
  },
  "authority_assurance": {
    "mode": "audit_only",
    "receipt_ref": null,
    "source": "declared_cli_attribution",
    "verified": false
  },
  "autonomy_ceiling": "bounded-autonomous",
  "checkpoints": [
    "deploy.remote",
    "pull_request.merge"
  ],
  "constraints": {
    "allowed_capabilities": [
      "filesystem.read",
      "git.commit",
      "git.push",
      "pull_request.create",
      "pull_request.merge",
      "repository.write"
    ],
    "allowed_environments": [
      "ci",
      "local"
    ],
    "allowed_tools": [
      "gh",
      "git",
      "node",
      "npm"
    ],
    "allowed_write_paths": [
      ".sdlc",
      "README.md",
      "bin",
      "docs",
      "lib",
      "package.json",
      "schemas",
      "scripts",
      "test",
      "ui"
    ],
    "budget_ref": null,
    "forbidden_actions": [
      "budget-extension",
      "destructive-action",
      "environment-change",
      "external-access",
      "external-publication",
      "gate-bypass",
      "global-install",
      "irreversible-migration",
      "new-tool-or-capability",
      "new-write-path",
      "production-access",
      "protected-branch-merge",
      "remote-deploy",
      "requirement-change",
      "scope-expansion",
      "secret-access",
      "security-privacy-compliance-decision"
    ]
  },
  "created_at": "2026-07-19T00:55:43.058Z",
  "exception_actions": [
    "budget-extension",
    "destructive-action",
    "environment-change",
    "external-access",
    "external-publication",
    "gate-bypass",
    "global-install",
    "irreversible-migration",
    "new-tool-or-capability",
    "new-write-path",
    "production-access",
    "protected-branch-merge",
    "remote-deploy",
    "requirement-change",
    "scope-expansion",
    "secret-access",
    "security-privacy-compliance-decision"
  ],
  "expires_at": null,
  "extensions": {
    "approved_profile_hash": "9105161617e5318bb7d26db002c8f08ffc6b9d20653ed34c3e0a79bf0390dd43"
  },
  "hash_algorithm": "sha256:stable-json:v1",
  "id": "AUT-REQ-ENT-PORTFOLIO-R2-R2",
  "kind": "requirement_execution_profile",
  "material_scope": {
    "acceptance_criteria": [
      "An explicit manifest can aggregate up to 64 project roots in declared order without filesystem discovery, while isolating unavailable projects.",
      "The portfolio summary reports bounded active workflows, blockers, risks, budgets, dependencies and releases, and its health reflects real blocking states.",
      "Summary collection does not build full project detail; detail caches are globally bounded, observable, evicted and disposed when the server closes.",
      "A read-only portfolio status command returns compact stable JSON and exits without exposing bearer tokens or absolute project paths.",
      "The web interface never shows one project's data under another project, persists valid project navigation in the URL, and remains accessible in English and Italian.",
      "Filesystem identity remains exact on Windows for identifiers beyond Number.MAX_SAFE_INTEGER.",
      "Node.js 18, 20 and 24 tests, the complete Node.js 24 suite, static checks and bounded performance validation pass before merge."
    ],
    "budget": null,
    "capabilities": [
      "filesystem.read",
      "gh",
      "git",
      "git.commit",
      "git.push",
      "node",
      "npm",
      "pull_request.create",
      "pull_request.merge",
      "repository.write"
    ],
    "environment": [
      "ci",
      "local"
    ],
    "integrations": [
      "Change Observatory HTTP server and browser UI",
      "Agentic SDLC command catalog and CLI dispatcher"
    ],
    "nfrs": [
      "Memory, file reads, concurrency, payloads and caches remain deterministically bounded.",
      "Errors in one project cannot prevent healthy projects from being inspected."
    ],
    "non_goals": [
      "Do not publish a package, create a release or install locally in this delivery.",
      "Do not discover projects by scanning parent folders."
    ],
    "objective": "Provide one explicit, read-only and bounded view of multiple Agentic SDLC projects, with useful operational health and lazy project detail; include the package manifest and portfolio schema required to distribute the feature.",
    "release_target": null,
    "requirement_constraints": [
      "Manifest size is limited to 256 KiB, project count to 64, collection concurrency to 4 and summary previews to 8.",
      "The portfolio is read-only and must preserve single-project Observatory behavior."
    ],
    "scope": "Provide one explicit, read-only and bounded view of multiple Agentic SDLC projects, with useful operational health and lazy project detail; include the package manifest and portfolio schema required to distribute the feature.",
    "write_paths": [
      ".sdlc",
      "README.md",
      "bin",
      "docs",
      "lib",
      "package.json",
      "schemas",
      "scripts",
      "test",
      "ui"
    ]
  },
  "material_scope_hash": "5f7e849dd691351889d9488334d1492b8a243e24fc70ae20bc6c69a59f59062a",
  "phase_levels": {},
  "profile_hash": "0768d10e3b3cbb2819318c1d0c2c67652c54fbda7bcef6a7e25a4eb63f50d463",
  "requirement_ref": {
    "hash": "da40e6ac092e2d2c7c866ffd614e3a6fc80cc1accc43b5b5ae3213eba53a9c8e",
    "id": "REQ-ENT-PORTFOLIO-R2",
    "path": ".sdlc/requirements/REQ-ENT-PORTFOLIO-R2.json",
    "version": 2
  },
  "schema_version": "requirement-execution-profile:v1",
  "status": "active",
  "updated_at": "2026-07-19T00:55:48.019Z",
  "valid_from": "2026-07-19T00:55:43.058Z",
  "version": 1
}
